<?xml version="1.0" encoding="UTF-8"?>
<document  
xmlns:xsi="http://www.w3.org/2001/XMLSchema-instance"
xmlns="http://document.schema"
xmlns:xi="http://www.w3.org/2001/XInclude"
 xmlns:xlink="http://www.w3.org/1999/xlink"
xsi:schemaLocation="http://document.schema document.xsd">
        <include src="bar.xml"/>
	
	<chapter title="This is my first chapter">
		<content>
			Lets write some text
			<source id="1" />
		</content>
		<include src="bar.xml"/>
		<section title="section">
		<include src="bar.xml"/>
			<content>blablaba</content>
			<subsection title="subsection">
				<content>text hier - text da</content>
				<subsubsection title="ganz tief">
				
					<content>asdfasdf</content>
					
				</subsubsection>
			</subsection>
		</section>
	</chapter>
	<chapter title="This is my 2nd chaper">
		<content>
			Lets write some text
			<sourceCode>
				<content>class HelloWorldApp {
    public static void main(String[] args) {
        System.out.println("Hello World!"); // Display the string.
    }
}
</content>
				<title>Test source code</title>
			</sourceCode>
			interesting thing above and below
			<figure>
				<source>classDiagramChatExample.png</source>
				<title>title 0</title>
			</figure>
			<figure>
				<source>classDiagramChatExample.png</source>
				<title>title 0,1</title>
			</figure>
		</content>
		<section title="asdf">
			<content>blablaba</content>
			<subsection title="noch eins">
				<content>text hier - text da</content>
				<subsubsection title="ganz tief">
					<content>
						asdfasdf
						<figure>
							<source>classDiagramChatExample.png</source>
							<title>titel1</title>
						</figure>
						<figure>
							<source>classDiagramChatExample.png</source>
							<title>titel2</title>
						</figure>
					</content>
				</subsubsection>
			</subsection>
		</section>
		<section title="asdf">
			<content>
				blablaba
				<source id="2" />
				blabla
			</content>
			<subsection title="noch eins">
				<content>text hier - text da</content>
				<subsubsection title="ganz tief">
					<content>asdfasdf</content>
				</subsubsection>
			</subsection>
		</section>
		<section title="asdf">
			<content>blablaba</content>
			<subsection title="noch eins">
				<content>text hier - text da</content>
				<subsubsection title="ganz tief">
					<content>asdfasdf</content>
				</subsubsection>
			</subsection>
		</section>
		<section title="asdf">
			<content>blablaba</content>
			<subsection title="noch eins">
				<content>text hier - text da</content>
				<subsubsection title="ganz tief">
					<content>
						asdfasdf
						<figure>
							<source>classDiagramChatExample.png</source>
							<title>title 4</title>
						</figure>
					</content>
				</subsubsection>
			</subsection>
		</section>
	</chapter>
	<bibliography>
		<source>
			<sourceId>1</sourceId>
			<author>Karl</author>
			<url>wikipedia</url>
			<title>How to not write xml</title>
		</source>
		<source>
			<sourceId>2</sourceId>
			<author>Karl</author>
			<url>wikipedia</url>
			<title>How to write xml</title>
		</source>
	</bibliography>
</document>